{
  "id": "git.index.controller",
  "version": "0.1.0",
  "summary": "Stage/unstage/add/reset controller (example)",
  "provides": [
    "IndexPort@1"
  ],
  "requires": [],
  "inputs": {},
  "outputs": {},
  "side_effects": [
    "Process:git",
    "FS:read",
    "FS:write"
  ],
  "invariants": [
    "idempotent(effect-free calls)"
  ],
  "tests": [
    "tests/spec_index.json"
  ],
  "evidence": [
    {
      "kind": "file",
      "file": "src/lib.rs",
      "lines": "1-20",
      "note": "example placeholder"
    }
  ]
}